[
  {
    "id": "containers",
    "shop": "general-store",
    "name": "Containers",
    "description": "Bags, boxes and vessels sold empty, with explicit carrying capacities.",
    "plannedItems": [
      "Backpack",
      "Pouch",
      "Sack",
      "Chest",
      "Lockbox",
      "Barrel",
      "Crate",
      "Basket",
      "Bottle",
      "Flask",
      "Waterskin",
      "Clay Jug",
      "Ceramic Jar",
      "Component Pouch",
      "Quiver",
      "Crossbow Bolt Case"
    ],
    "catalogue": "general-store",
    "sort": 0,
    "visible": true,
    "icon": "icons/containers/bags/pack-leather-white-tan.webp"
  },
  {
    "id": "fire-lighting",
    "shop": "general-store",
    "name": "Lighting & Fire",
    "description": "Portable lights, fuel and everyday fire-making supplies.",
    "plannedItems": [
      "Torch",
      "Candle",
      "Beeswax Candle",
      "Tallow Candle",
      "Lantern",
      "Hooded Lantern",
      "Bullseye Lantern",
      "Lamp",
      "Lamp Oil",
      "Tinderbox",
      "Flint & Steel",
      "Charcoal",
      "Kindling",
      "Lamp Wick",
      "Candle Holder",
      "Candle Snuffer",
      "Firewood"
    ],
    "catalogue": "general-store",
    "sort": 10,
    "visible": true,
    "icon": "icons/sundries/lights/torch-black.webp"
  },
  {
    "id": "rope-climbing",
    "shop": "general-store",
    "name": "Rope & Climbing",
    "description": "Cordage, anchors and equipment for secured climbing.",
    "plannedItems": [
      "Hempen Rope",
      "Silk Rope",
      "Twine",
      "Grappling Hook",
      "Pitons",
      "Climber's Kit",
      "Block and Tackle",
      "Chain",
      "Rope Ladder",
      "Belaying Pin",
      "Rigid Ladder, 10 ft."
    ],
    "catalogue": "general-store",
    "sort": 20,
    "visible": true,
    "icon": "icons/sundries/survival/rope-wrapped-brown.webp"
  },
  {
    "id": "camping",
    "shop": "general-store",
    "name": "Camping",
    "description": "Shelter, bedding and reusable camp kitchen equipment.",
    "plannedItems": [
      "Blanket",
      "Bedroll",
      "Tent",
      "Bedroll Strap",
      "Mess Kit",
      "Cooking Pot",
      "Camp Kettle",
      "Cup",
      "Bowl",
      "Spoon",
      "Wooden Plate",
      "Groundsheet",
      "Tarpaulin",
      "Hammock",
      "Tent Pegs",
      "Cooking Tripod",
      "Skillet",
      "Ladle",
      "Chopping Board",
      "Travel Rations",
      "Fishing Tackle"
    ],
    "catalogue": "general-store",
    "sort": 30,
    "visible": true,
    "icon": "icons/commodities/cloth/cloth-bolt-gold-orange.webp"
  },
  {
    "id": "writing",
    "shop": "general-store",
    "name": "Writing",
    "description": "Writing surfaces, marking supplies and seals.",
    "plannedItems": [
      "Parchment",
      "Paper",
      "Ink",
      "Ink Pen",
      "Chalk",
      "Wax",
      "Sealing Stamp",
      "Blank Book",
      "Ledger",
      "Wax Tablet",
      "Slate",
      "Blotting Sand",
      "Document Case",
      "Spellbook"
    ],
    "catalogue": "general-store",
    "sort": 40,
    "visible": true,
    "icon": "icons/sundries/scrolls/scroll-plain-tan.webp"
  },
  {
    "id": "household",
    "shop": "general-store",
    "name": "Household",
    "description": "Cleaning, sewing and other ordinary household needs.",
    "plannedItems": [
      "Soap",
      "Needle",
      "Thread",
      "Sewing Kit",
      "Broom",
      "Mop",
      "Wash Bucket",
      "Wash Board",
      "Clothes Line",
      "Cloth Rags",
      "Hand Towel",
      "Clothes Pegs",
      "Wooden Buttons",
      "Thimble",
      "Comb",
      "Door Hinges",
      "Padlock",
      "Mortar and Pestle"
    ],
    "catalogue": "general-store",
    "sort": 50,
    "visible": true,
    "icon": "icons/sundries/survival/soap.webp"
  },
  {
    "id": "animal",
    "shop": "general-store",
    "name": "Animal Supplies",
    "description": "Feed, grooming supplies and routine tack maintenance.",
    "plannedItems": [
      "Horse Feed",
      "Feed Bag",
      "Brush",
      "Curry Comb",
      "Horseshoes",
      "Tack Repair Kit",
      "Halter",
      "Lead Rope",
      "Saddle Blanket",
      "Horse Hobbles",
      "Picket Line",
      "Saddlebags"
    ],
    "catalogue": "general-store",
    "sort": 60,
    "visible": true,
    "icon": "icons/consumables/grains/sack-rice-flour-brown.webp"
  },
  {
    "id": "travel",
    "shop": "general-store",
    "name": "Travel",
    "description": "Navigation aids, signalling tools and practical travelling accessories.",
    "plannedItems": [
      "Walking Stick",
      "Compass",
      "Spyglass",
      "Bell",
      "Signal Whistle",
      "Steel Mirror",
      "Hourglass",
      "Road Map",
      "Waterproof Document Wrap",
      "Travel Cloak",
      "Pack Cover",
      "Canvas Repair Patches",
      "Marking Ribbon",
      "Pole, 10 ft."
    ],
    "catalogue": "general-store",
    "sort": 70,
    "visible": true,
    "icon": "icons/commodities/wood/wood-pole.webp"
  },
  {
    "id": "tools",
    "shop": "general-store",
    "name": "Tools",
    "description": "Individual hand tools, measuring aids and workshop fittings; no implied artisan proficiency sets.",
    "plannedItems": [
      "Hammer",
      "Crowbar",
      "Hand Saw",
      "Chisel",
      "Wooden Mallet",
      "Shovel",
      "Miner's Pick",
      "Sledgehammer",
      "Whetstone",
      "Iron Nails",
      "Iron Spikes",
      "Measuring Cord",
      "Wooden Rule",
      "Tool Wrap",
      "Wooden Wedges",
      "Merchant's Scale",
      "Herbalism Kit",
      "Navigator's Tools"
    ],
    "catalogue": "general-store",
    "sort": 80,
    "visible": true,
    "icon": "icons/tools/hand/hammer-cobbler-steel.webp"
  },
  {
    "id": "trade-goods",
    "shop": "general-store",
    "name": "Trade Goods",
    "description": "Clearly measured cloth, leather, metals and ordinary materials for local trade and craft work.",
    "plannedItems": [
      "Linen",
      "Canvas",
      "Wool Cloth",
      "Leather",
      "Iron Bar",
      "Copper Bar",
      "Salt",
      "Beeswax",
      "Pitch",
      "Cloth Dye",
      "Silk Cloth"
    ],
    "catalogue": "general-store",
    "sort": 90,
    "visible": true,
    "icon": "icons/commodities/cloth/cloth-bolt-gold-orange.webp"
  },
  {
    "id": "ale",
    "shop": "tavern",
    "name": "Ale",
    "description": "Locally brewed ales, from light table drinks to strong cellar pours.",
    "plannedItems": [
      "Small Ale",
      "Brown Hearth Ale",
      "Oat Ale",
      "Heather Ale",
      "Smoked Malt Ale",
      "Harvest Ale",
      "Strong Cellar Ale",
      "Old Oak Ale"
    ],
    "catalogue": "tavern",
    "sort": 100,
    "visible": true,
    "icon": "icons/consumables/drinks/alcohol-beer-stein-wooden-brown.webp"
  },
  {
    "id": "beer",
    "shop": "tavern",
    "name": "Beer",
    "description": "Hopped and cool-fermented beers, separated from the ale menu for browsing.",
    "plannedItems": [
      "House Hopped Beer",
      "Pale Bitter Beer",
      "Dark Rye Beer",
      "Cloudy Wheat Beer",
      "Cool Cellar Beer",
      "Red Malt Beer",
      "Juniper Beer",
      "Double Malt Beer"
    ],
    "catalogue": "tavern",
    "sort": 110,
    "visible": true,
    "icon": "icons/consumables/drinks/alcohol-beer-stein-wooden-brown.webp"
  },
  {
    "id": "mead",
    "shop": "tavern",
    "name": "Mead",
    "description": "Honey wines served by the half-pint; fruit and herb variants share the same unit.",
    "plannedItems": [
      "House Honey Mead",
      "Dry Meadow Mead",
      "Heather Honey Mead",
      "Apple Mead",
      "Blackberry Mead",
      "Spiced Winter Mead",
      "Oak-Aged Mead",
      "Rose Petal Mead"
    ],
    "catalogue": "tavern",
    "sort": 120,
    "visible": true,
    "icon": "icons/consumables/drinks/alcohol-beer-stein-wooden-brown.webp"
  },
  {
    "id": "wine",
    "shop": "tavern",
    "name": "Wine",
    "description": "Table wines and scarce cellar wines by the quarter-pint.",
    "plannedItems": [
      "House Red Wine",
      "House White Wine",
      "Rosy Table Wine",
      "Sweet Red Wine",
      "Orchard Pear Wine",
      "Blackcurrant Wine",
      "Mulled Red Wine",
      "Reserve Vineyard Wine"
    ],
    "catalogue": "tavern",
    "sort": 130,
    "visible": true,
    "icon": "icons/consumables/drinks/wine-amphora-clay-red.webp"
  },
  {
    "id": "spirits",
    "shop": "tavern",
    "name": "Spirits",
    "description": "Distilled drinks sold by a one-fluid-ounce measure, not a bottle.",
    "plannedItems": [
      "Grain Spirit",
      "Apple Brandy",
      "Pear Brandy",
      "Plum Spirit",
      "Juniper Spirit",
      "Dark Cane Spirit",
      "Spiced Honey Liqueur",
      "Cask-Aged Grain Spirit"
    ],
    "catalogue": "tavern",
    "sort": 140,
    "visible": true,
    "icon": "icons/consumables/drinks/alcohol-jar-spirits-gray.webp"
  },
  {
    "id": "non-alcoholic-drinks",
    "shop": "tavern",
    "name": "Non-alcoholic Drinks",
    "description": "Water, milk and unfermented fruit drinks for the table.",
    "plannedItems": [
      "Drinking Water",
      "Barley Water",
      "Fresh Cow Milk",
      "Fresh Goat Milk",
      "Pressed Apple Juice",
      "Pear Juice",
      "Honey Lemon Water",
      "Blackberry Shrub Drink"
    ],
    "catalogue": "tavern",
    "sort": 150,
    "visible": true,
    "icon": "icons/consumables/drinks/tea-jug-gourd-brown.webp"
  },
  {
    "id": "hot-drinks",
    "shop": "tavern",
    "name": "Hot Drinks",
    "description": "Small cups of prepared tea, infusions, coffee and warm milk.",
    "plannedItems": [
      "Mint Infusion",
      "Chamomile Infusion",
      "Roasted Barley Drink",
      "Spiced Warm Milk",
      "Black Leaf Tea",
      "Green Leaf Tea",
      "Strong Black Coffee",
      "Spiced Cocoa"
    ],
    "catalogue": "tavern",
    "sort": 160,
    "visible": true,
    "icon": "icons/consumables/drinks/tea-jug-gourd-brown.webp"
  },
  {
    "id": "breakfast",